"conversation_id_str","created_at","favorite_count","full_text","id_str","image_url","in_reply_to_screen_name","lang","location","quote_count","reply_count","retweet_count","tweet_url","user_id_str","username"
"1795270930824040456","Tue May 28 01:48:39 +0000 2024","28903","kalo gaji 10 juta per bulan dipotong tapera 3% = 300 ribu/bulan 1 tahun = 3 6 juta. 100 tahun menabung akhirnya bisa deh dapet rumah yang harganya 360 juta. ngitungnya gitu gak sih?","1795270930824040456","","","in","","1357","3015","8917","https://x.com/solehsolihun/status/1795270930824040456","95370094","solehsolihun"
"1795810852391846368","Wed May 29 13:34:06 +0000 2024","7455","Putri (bukan nama sebenarnya) seorang pensiunan guru PNS peserta program tabungan perumahan yang waktu itu namanya Bapertarum hanya mendapat pencairan Rp 6 6 juta dari periode kepesertaannya selama 28 tahun. #focus #tapera #bisnis #videonews https://t.co/OfNzXiFwnU https://t.co/1xIQrdBFKH","1795810852391846368","https://pbs.twimg.com/amplify_video_thumb/1795810767222214656/img/3KNrhZUedgja5dkt.jpg","","in","","715","823","3875","https://x.com/kumparan/status/1795810852391846368","759692754985242625","kumparan"
"1795375053997269022","Tue May 28 08:42:23 +0000 2024","4957","Gaji pekerja di Indonesia anggap pukul rata 4jt sebulan setara 48jt setahun. Potong 3% untuk Tapera 1.5jt. Dikali jumlah pekerja yg terdaftar di BPJS Ketenagakerjaan 41.5jt orang totalnya 60 T tiap tahun. Kalo km jd manajer investasinya bakal diputar kemana tuh duit?","1795375053997269022","","","in","","273","947","1305","https://x.com/investorgabut/status/1795375053997269022","185523454","investorgabut"
"1795463085286887931","Tue May 28 14:32:12 +0000 2024","21369","Bayangin jadi warga Indonesia dalam satu minggu kudu awas sama isu UKT isu student loan isu RUU Polri isu RUU Penyiaran isu gaji pribadi mau dipotong langsung sama negara buat Tapera... sambil menonton fakta demi fakta berikut ini: https://t.co/ykwLLcke3B","1795463085286887931","https://pbs.twimg.com/media/GOrEJxaaEAADZ1O.jpg","","in","Yogyakarta, Indonesia","1021","508","10364","https://x.com/mardiasih/status/1795463085286887931","164627338","mardiasih"
"1796533581084553242","Fri May 31 13:25:58 +0000 2024","26486","Berarti Tapera untuk Biayai Program Makan Siang Gratis dan Proyek IKN","1796533581084553242","","","in","","392","315","9450","https://x.com/sandalista1789/status/1796533581084553242","546258782","sandalista1789"
"1795305149524738075","Tue May 28 04:04:37 +0000 2024","40248","Lu bayangin ya ada karyawan akhirnya gajinya 10 juta. Mau celebrate. Lalu: Pajak TER 2% BPJS Kes karyawan 1% BPJS TK: 2% JHT 1% JP Trus bakal nambah Tapera 2 5% Belum apa-apa udah kepotong 7 5%. Ga ngapa-ngapain aja uangnya udah kepotong 750ribu.","1795305149524738075","","","in","unfinishedscript.tumblr.com","2507","998","11832","https://x.com/ribkadel/status/1795305149524738075","83760592","ribkadel"
"1795034407453032484","Mon May 27 10:08:47 +0000 2024","14777","Semua orang dengan penghasilan diatas UMR akan kena potongan 3% untuk TAPERA????? Monyet lingkar istana yang mana lagi ini yang pegang hak ekslusif pengelolaan dananya? https://t.co/TyOTLWpqhb","1795034407453032484","https://pbs.twimg.com/media/GOk80xIboAAgRS4.png","","in","Indonesia","985","682","6057","https://x.com/ruliemaulana/status/1795034407453032484","185320244","ruliemaulana"
"1799036812893241805","Fri Jun 07 11:12:55 +0000 2024","15133","Untuk apa Tapera kalau presiden terpilih aja berjanji akan bangun 3 juta rumah https://t.co/BJKNw6f3jx","1799036812893241805","https://pbs.twimg.com/ext_tw_video_thumb/1799036788662763520/pu/img/n4TvrYRzx5yfXXOA.jpg","","in","DKI Jakarta, Indonesia","393","465","4576","https://x.com/Mdy_Asmara1701/status/1799036812893241805","1334853481019056128","Mdy_Asmara1701"
"1270005614303825920","Mon Jun 08 14:51:48 +0000 2020","2747","Kebusukan dari program Tapera adalah agenda menyelamatkan bank plat merah Bank BTN yang dalam kondisi megap-megap Dengan memotong gaji PNS dan swasta 2 5 persen Dan semua tertuju pada Taperanya bukan pada kondisi Bank BTN diluar tanggungjawab pemerintahan Jokowi https://t.co/FmMTGryKnx","1270005614303825920","https://pbs.twimg.com/media/EZ_3XN4UcAEC8O0.jpg","","in","Pulau Reklamasi Jakarta Utara","96","252","1239","https://x.com/podoradong/status/1270005614303825920","1241349546627567616","podoradong"
"1798931644122063126","Fri Jun 07 04:15:01 +0000 2024","17904","Momen Pak Bas di cecar soal Tapera https://t.co/DjwWheWaxk","1798931644122063126","https://pbs.twimg.com/ext_tw_video_thumb/1798931042293964800/pu/img/ufS7LOkg_s8CTYT_.jpg","","in","DIHATIMU","474","263","3627","https://x.com/Cintada16/status/1798931644122063126","1279643013455605760","Cintada16"
"1796065128485376251","Thu May 30 06:24:30 +0000 2024","38819","masyaAllah pemerintah baiiiiik banget akhirnya aku punya kesempatan buat beli rumah di menteng pake tabungan tapera setelah 7x reinkarnasi","1796065128485376251","","","in","🍉","1493","498","10386","https://x.com/akunyakul/status/1796065128485376251","1296643411064131584","akunyakul"
"1796895515650752886","Sat Jun 01 13:24:10 +0000 2024","14849","2015 - 8K 2018 - 10K 2019 - 12K 2022 - 13K 2024 - 14K Ada yang percaya Tapera? https://t.co/kMcohLROu8","1796895515650752886","https://pbs.twimg.com/media/GO_a8O7b0AADDai.jpg","","in","","337","633","2626","https://x.com/Dandhy_Laksono/status/1796895515650752886","159919812","Dandhy_Laksono"
"1797592030958526657","Mon Jun 03 11:31:52 +0000 2024","6339","Temuan BPK: Dana Tapera Rp 567 Miliar Belum Kembali ke Peserta Baca di https://t.co/AWoPoNV4E9 https://t.co/U3SInf3kYZ","1797592030958526657","https://pbs.twimg.com/media/GPJUYn3aYAE7bLW.jpg","","in","Jakarta","678","455","2532","https://x.com/kompascom/status/1797592030958526657","23343960","kompascom"
"1821346883555750327","Thu Aug 08 00:45:10 +0000 2024","175","Serikat Buruh Gugat ke MK untuk Cabut UU Tapera Siapa Lagi Tolak Kewajiban Tapera? https://t.co/H4pT2SzsLk #TempoBisnis","1821346883555750327","","","in","Indonesia","3","8","80","https://x.com/tempodotco/status/1821346883555750327","18129942","tempodotco"
"1798014509308879153","Tue Jun 04 15:30:39 +0000 2024","40114","Rumah hasil TAPERA selama 20 tahun https://t.co/m4gJbdJRf7","1798014509308879153","https://pbs.twimg.com/media/GPPUqwVakAA0Pdx.jpg","","in","Jakarta Capital Region","937","904","9462","https://x.com/tvindonesiawkwk/status/1798014509308879153","1329295844869214208","tvindonesiawkwk"
"1797822760858845368","Tue Jun 04 02:48:42 +0000 2024","11415","Keren ini. Rohingya ditampung Gaza ditampung Rakyat sendiri menghadapi - harga beras naik - BBM naik - UKT naik* - Sembako naik - transport naik - cicilan naik - pajak naik - potongan Tapera - potongan BPJS kesehatan - potongan ketenagakerjaan - terjerat pinjol - dll. https://t.co/wZClWAsPRG","1797822760858845368","https://pbs.twimg.com/media/GPMmRg-bgAAjBdk.jpg","","in","Indonesia","429","829","2705","https://x.com/narkosun/status/1797822760858845368","84221579","narkosun"
"1795344130186641408","Tue May 28 06:39:31 +0000 2024","14741","Ngeluh soal tapera malah dibilang anak abah ckck","1795344130186641408","","","in","Jakarta, Indonesia","323","413","3273","https://x.com/kemalpalevi/status/1795344130186641408","47094694","kemalpalevi"
"1795242655678669121","Mon May 27 23:56:17 +0000 2024","3390","MANFAAT TAPERA Jadi kalau belum punya rumah bisa KPR dengan plafon yg sudah ditetapkan tergantung wilayah. Yg udh punya rumah bisa ambil opsi renovasi dg plafon yg udh d tetapkan Tp tetep bayar cicilannya yaa. Bukan berarti udh iuran 3% berarti g bayar lagi xixixi https://t.co/ptzzpPiBKs","1795242655678669121","https://pbs.twimg.com/media/GOn7rkQbUAA5rXW.jpg","","in","belakang meja","549","340","1195","https://x.com/anak_legal/status/1795242655678669121","1367747750687694848","anak_legal"
"1820761756316401890","Tue Aug 06 10:00:05 +0000 2024","31","Konfederasi Serikat Buruh Gugat Kebijakan Tapera ke MK https://t.co/LzVyQZ01pr","1820761756316401890","","","in","","0","0","25","https://x.com/OposisiCerdas/status/1820761756316401890","887743587579944960","OposisiCerdas"
"1795344621536686222","Tue May 28 06:41:28 +0000 2024","7908","Rumah hasil dari nabung simpanan Tapera. https://t.co/KiP2guuoSK","1795344621536686222","https://pbs.twimg.com/media/GOpYac7aIAEMTja.jpg","","in","Jakarta Capital Region","266","247","3193","https://x.com/BigAlphaID/status/1795344621536686222","958566590768926721","BigAlphaID"
"1821346883555750327","Thu Aug 08 12:53:17 +0000 2024","0","@tempodotco lhaa bukanya lebih baik issunya reshufel menteri tenaga kerja ?? sebab salah satu satuan kerja pemerintah yang menggodok UU Tapera ya kementrian tenaga kerja. cocoknya si ke situ issunya lebih affdoollll","1821530118206177581","","tempodotco","in","","0","0","0","https://x.com/Partikellirs/status/1821530118206177581","1594732397492195330","Partikellirs"
"1820753768071516409","Tue Aug 06 09:28:20 +0000 2024","20","Konfederasi Serikat Buruh Seluruh Indonesia (KSBSI) mengajukan uji materiil UU Tapera ke MK. Haris Manalu selaku kuasa hukum Pemohon menyebutkan upah pekerja/buruh mandiri masih kecil bahkan tidak mencukupi untuk kebutuhan hidup layak diharuskan membayar iuran jaminan sosial https://t.co/EZDU9oPi5y","1820753768071516409","https://pbs.twimg.com/media/GUSd4MJaEAAHqKe.jpg","","in","Jakarta Pusat, DKI Jakarta","1","1","6","https://x.com/officialMKRI/status/1820753768071516409","517105241","officialMKRI"
"1268452675982520321","Thu Jun 04 08:00:59 +0000 2020","2230","Makin ngaco aja. Apaan coba pake ada PP No.25 tahun 2020 tentang Tapera. Gaji pekerja dipotong 3% tiap bulan buat tabungan rumah. Ini WAJIB buat ASN ataupun SWASTA!!. Nabungnya sampe kapan? Nyicil rumah jutaan perbulan aja lama apalagi dari potongan 3% https://t.co/aCJEOSiMuX","1268452675982520321","","","in","DKI Jakarta, Indonesia","222","210","933","https://x.com/mazzini_gsp/status/1268452675982520321","1226038913707282433","mazzini_gsp"
"1269609476123791360","Sun Jun 07 12:37:41 +0000 2020","22","Wasekjen Partai Demokrat @irwan_fecho menyebut pemerintah sedang mencari uang dari masyarakat dg menerbitkan regulasi yg memotong gaji PNS TNI POLRI pekerja BUMN BUMD &amp; pegawai swasta utk iuran Tapera. Simak pendapat Irwan selengkapnya di video ini. #Tapera #PartaiDemokrat https://t.co/gfsse1gyg5","1269609476123791360","https://pbs.twimg.com/ext_tw_video_thumb/1269609047008743424/pu/img/6ef-UbwQmWOnLRfz.jpg","","in","","1","1","12","https://x.com/Demokrat_TV/status/1269609476123791360","284830933","Demokrat_TV"
"1820808973018423729","Tue Aug 06 13:12:44 +0000 2024","4","Sebagai contoh pemerintah baru ambil tindakan dengan mengkaji ulang kebijakan soal Tapera dan RUU Penyiaran setelah terjadi protes dari warga. https://t.co/KPkgxDxrBE","1820810236942602722","https://pbs.twimg.com/media/GUTRQRdb0AARXjx.jpg","remotivi","in","Indonesia","0","1","0","https://x.com/remotivi/status/1820810236942602722","172750034","remotivi"
"1269610655633399808","Sun Jun 07 12:42:23 +0000 2020","39","Sahabat Demokrat Anggota Komisi V DPR RI dari Fraksi Partai Demokrat @irwan_fecho mengkritik Presiden Joko Widodo yang telah menandatangani Peraturan Pemerintah (PP) Nomor 25 Tahun 2020 tentang Penyelenggaraan Tapera di tengah Pandemi Covid-19. #DemokratPeduliDanBeriSolusi https://t.co/S1VEVJd4SZ","1269610655633399808","https://pbs.twimg.com/ext_tw_video_thumb/1269610071618547713/pu/img/hISnNEgiWU4AR5sW.jpg","","in","Jakarta Capital Region","1","2","21","https://x.com/PDemokrat/status/1269610655633399808","248199104","PDemokrat"
"1269984438047215617","Mon Jun 08 13:27:39 +0000 2020","1134","Listrik Mahal BPJS Naik Gaji Dipotong Tapera; Nasib PNS Semakin Kegencet https://t.co/zNnAz3WJ2d","1269984438047215617","","","in","Indonesia","49","101","357","https://x.com/geloraco/status/1269984438047215617","3319260420","geloraco"
"1270004617481420800","Mon Jun 08 14:47:51 +0000 2020","10","#NewProfilePic https://t.co/VeSN2awZhS","1270004617481420800","https://pbs.twimg.com/media/EZ_2dorWkAEXp1m.jpg","","qme","Manyene, Chivhu Zimbabwe ","1","3","0","https://x.com/tapera_david/status/1270004617481420800","3588528675","tapera_david"
"1269967369922727937","Mon Jun 08 12:19:50 +0000 2020","41","Wasekjen @pdemokrat @irwan_fecho memperingatkan pemerintah jangan sampai masyarakat menjadi korban dari kegagalan pemerintah mengelola sektor ekonomi pasca keluarkan PP No. 25 Tahun 2020 yang mana salah satu isinya ialah pemerintah potong 3% gaji pegawai untuk iuran Tapera. https://t.co/mzL3dzNhiw","1269967369922727937","https://pbs.twimg.com/ext_tw_video_thumb/1269966710016110594/pu/img/3oEBKGIFBLPTRzfy.jpg","","in","","0","0","13","https://x.com/BakomstraPD/status/1269967369922727937","1264275110636052482","BakomstraPD"
"1821424853620056075","Thu Aug 08 14:05:11 +0000 2024","0","@detikcom Alhamdulillah ngga jadi pajak naik thn besok rupiah menguat ngga ada tapera. Yaaa kan pak? Kalo msh ada itu semua artinya BAPAK BOHONG!","1821548213528342938","","detikcom","in","Jakarta Capital Region","0","0","0","https://x.com/riobmhmeru/status/1821548213528342938","1700518523884494848","riobmhmeru"
"1269810799364632576","Mon Jun 08 01:57:41 +0000 2020","850","Listrik Mahal BPJS Naik Gaji Dipotong Tapera Nasib PNS Semakin Kegencet https://t.co/RERIRG7yFA","1269810799364632576","","","in","Jakarta Capital Region","21","70","343","https://x.com/OssyDermawan/status/1269810799364632576","986216802299473921","OssyDermawan"
"1269427657772425216","Sun Jun 07 00:35:13 +0000 2020","736","Ada yg jago berburu betulan. Ada yg jagoan BERBURU DI KBN BINATANG. Contohnya: 1. Naikin tarif BPJS saat covid 2. Narik iuran Tapera saat covid 3. Duit calhaj mau diutak-atik 4. Ogah nurunin hrg BBM 5. Diam2 tarif PLN bikn sesak napas Hallo buzzeRp elo manusia?","1269427657772425216","","","in","ÜT: -6.256275,106.814993","8","34","246","https://x.com/syahrial_nst/status/1269427657772425216","181556049","syahrial_nst"
"1269775379960442880","Sun Jun 07 23:36:56 +0000 2020","4","Penunjukkan Bank BRI (BBRI) sebagai Bank Kustodian untuk Program Tabungan Perumahan Rakyat (Tapera) maka akan ada potensi kenaikan pendapatan BBRI berbasis komisi. . Tapera merupakan Program Pemerintah untuk menyediakan perumahan bagi Masyarakat Berpenghasilan Rendah (MBR) https://t.co/qeEQkghotI","1269775379960442880","https://pbs.twimg.com/media/EZ8l9UMUwAAJgkM.jpg","","in","Indonesia","2","1","2","https://x.com/yossygirsang/status/1269775379960442880","266100204","yossygirsang"
"1269864230779523072","Mon Jun 08 05:30:00 +0000 2020","206","Ekonom Indef Bhima Yudhistira menyebut kebijakan yang memberatkan buruh di tengah masa pandemi ini hanya akal-akalan pemerintah untuk mencari pendapatan baru di tengah kondisi keuangan negara yang tengah tertekan dengan cara instan. https://t.co/ORPzNWSI06","1269864230779523072","","","in","Indonesia","17","19","106","https://x.com/TirtoID/status/1269864230779523072","4187275698","TirtoID"
"1268107157062348801","Wed Jun 03 09:08:01 +0000 2020","74","Presiden Joko Widodo pada 20 Mei lalu menandatangani Peraturan Pemerintah Nomor 25 Tahun 2020 tentang Penyelenggaraan Tapera (Tabungan Perumahan Rakyat).⁣ #Narasi #Narasinewsroom https://t.co/oZtyDDV4Vw","1268107157062348801","https://pbs.twimg.com/media/EZk4t6SVcAIF5Yz.jpg","","in","","15","17","28","https://x.com/NarasiNewsroom/status/1268107157062348801","1158355819512991747","NarasiNewsroom"
"1269956358754848768","Mon Jun 08 11:36:05 +0000 2020","1","Apindo Konsisten Tolak Program Tapera Ini Alasannya https://t.co/TfFGm6RaIo","1269956358754848768","","","in","Jakarta","0","0","1","https://x.com/HukumOnline/status/1269956358754848768","125297822","HukumOnline"
"1269984072006156295","Mon Jun 08 13:26:12 +0000 2020","6","Melesat 54% Analis Nilai Saham BBTN Ditopang Fundamental dan Katalis Tapera https://t.co/p7WBm3IECu https://t.co/AvM11IQBsV","1269984072006156295","https://pbs.twimg.com/media/EZ_jxZEU0AEnweH.jpg","","in","Jakarta, Indonesia","0","0","0","https://x.com/InvestorID/status/1269984072006156295","238091066","InvestorID"
"1269828168304791553","Mon Jun 08 03:06:42 +0000 2020","4","Program Tapera yang wajib diikuti oleh setiap tenaga kerja menuai pro dan kontra di masyarakat. Simak #Blakblakan bersama Deputi Komisioner BP Tapera Nostra Siagian di sini. https://t.co/9uSNCU0rMd","1269828168304791553","","","in","Jakarta, Indonesia","0","1","2","https://x.com/detikfinance/status/1269828168304791553","135795460","detikfinance"
"1269898945322348546","Mon Jun 08 07:47:56 +0000 2020","114","Ada yang kepikiran ga si. Rakyat bayar pajak untuk bangun fasilitas2 publik tapi untuk menggunakan fasilitas publik tersebut rakyat juga mesti bayar. Mereka digaji dan diuntungkan dari proyek2 yg bearasal dari pajak rakyat. Bener ga..? https://t.co/OmexVztROf","1269898945322348546","","","in","Pondok Aren, Indonesia","0","5","22","https://x.com/Robert_Piliang/status/1269898945322348546","1180825246439333888","Robert_Piliang"
"1269950030141706240","Mon Jun 08 11:10:56 +0000 2020","5","Produk tabungan perumahan (Tapera) muncul secara tiba-tiba di tengah pandemi Corona. Penghasilan pekerja bakal dipotong 3% dan masuk ke dalam tabungan. https://t.co/qP4w5amR0Z","1269950030141706240","","","in","Jakarta, Indonesia","0","1","4","https://x.com/detikfinance/status/1269950030141706240","135795460","detikfinance"
"1267997964019970049","Wed Jun 03 01:54:07 +0000 2020","513","Kasian lama-lama dengan para pemilih Jokowi Nunggu harga BBM diturunkan ternyata malah Iuran BPJS yang dinaikan.. Berharap cicilan tunggakan bisa dikurangi ternyata malah Gaji mau dipotong lagi Iuran Tapera. Pura-pura bahagia aja terus sampe kiamat.","1267997964019970049","","","in","Bima Sakti, Bumi, Indonesia","16","30","190","https://x.com/abu_waras/status/1267997964019970049","2905814730","abu_waras"
"1268034546450051072","Wed Jun 03 04:19:29 +0000 2020","1","Siapa yang gajinya akan dipotong untuk tabungan perumahan rakyat?! Cek Pasal 5 dan Pasal 7 PP No.25 Tahun 2020. Banyak sekali potongan gaji pajak bpjs kemudian tapera. https://t.co/NFlAilouMk","1268034546450051072","https://pbs.twimg.com/media/EZj2qw7UwAAXHYR.jpg","","in","Sidoarjo-Surabaya","0","1","2","https://x.com/TaheggaAlfath/status/1268034546450051072","74379565","TaheggaAlfath"
"1268044329953738752","Wed Jun 03 04:58:22 +0000 2020","951","UU Tapera nggak penting abis asli","1268044329953738752","","","in","jalansantai@gmail.com","21","100","242","https://x.com/ridwanhr/status/1268044329953738752","43922847","ridwanhr"
"1268016160848506881","Wed Jun 03 03:06:26 +0000 2020","950","Presiden Jokowi menandatangani PP Nomor 25 tahun 2020 tentang Penyelenggaraan Tabungan Perumahan Rakyat (Tapera). Dalam aturan itu seluruh pekerja diwajibkan mengikuti program Tapera. https://t.co/MDagv9t8n1","1268016160848506881","","","in","Indonesia","1401","693","627","https://x.com/TirtoID/status/1268016160848506881","4187275698","TirtoID"
"1268024522566856704","Wed Jun 03 03:39:39 +0000 2020","37","CNN Indonesia -- Pemerintah akan memotong gaji PNS TNI Polri pekerja BUMN BUMD dan pegawai swasta untuk iuran Tabungan Perumahan Rakyat atau Tapera. Ketentuan ini tertuang dalam Peraturan Pemerintah Nomor 25 Tahun 2020 tentang Penyelenggaraan Tapera. https://t.co/WoyAx6hw6o","1268024522566856704","https://pbs.twimg.com/media/EZjtk3yUMAAiK5L.jpg","","in","","6","6","23","https://x.com/Nugroho_S88/status/1268024522566856704","1210073273863589888","Nugroho_S88"
"1268066957359673345","Wed Jun 03 06:28:16 +0000 2020","25","ga semua orang urgensi-nya rumah. BPJS kelas 3 aja per Januari lalu sampe 9.8 juta peserta yang nunggak. sekarang ditambah lagi Tapera. kasian banget nasib mereka yang penghasilannya pas pasan.","1268066957359673345","","","in","","2","1","15","https://x.com/cinnamongirlc/status/1268066957359673345","58184629","cinnamongirlc"
"1268029315809083392","Wed Jun 03 03:58:42 +0000 2020","3390","Sudah ada BPJS Ketenagakerjaan lalu untuk apa Tapera Ataukah ini TAPERA (Teknik Ancam PEras RAkyat) Peras rakyat untuk kas negara","1268029315809083392","","","in","Pulau Reklamasi Jakarta Utara","30","120","1050","https://x.com/podoradong/status/1268029315809083392","1241349546627567616","podoradong"
"1268049668547608576","Wed Jun 03 05:24:03 +0000 2020","23","Sekedar info tentang kredit rumah lewat BPJS Ketenagakerjaan. Jika masih harus bayar Tapera lantas buat apa bayar BPJS TK? https://t.co/DMH0X9gMEv https://t.co/exnLo6589L","1268050795926130690","https://pbs.twimg.com/media/EZkFd1XXkAMo-Jr.jpg","PartaiSocmed","in","Indonesia","1","2","19","https://x.com/PartaiSocmed/status/1268050795926130690","869327120","PartaiSocmed"
"1268018543003447298","Wed Jun 03 03:15:53 +0000 2020","891","Jokowi Teken PP Tapera Gaji Pekerja Siap-siap Dipotong untuk Tabungan Perumahan Hiaahh iuran lagi buat swasta yg gak mau ikutan ada sangsi duuh lier aing https://t.co/AYQxEAjK3s","1268018543003447298","","","in","DKI Jakarta, Indonesia","30","163","343","https://x.com/marlina_idha/status/1268018543003447298","719725925215170561","marlina_idha"
"1268016160848506881","Wed Jun 03 06:23:42 +0000 2020","141","UU Tapera mewajibkan gaji pekerja disisihkan sebesar 3% untuk tabungan perumahan. Pemerintah berdalih iuran ini membantu mewujudkan mimpi pekerja memiliki rumah. https://t.co/LOJoOy2hYm","1268065805213696003","","TirtoID","in","Indonesia","235","71","84","https://x.com/TirtoID/status/1268065805213696003","4187275698","TirtoID"
"1268045514739576834","Wed Jun 03 05:03:04 +0000 2020","37","Simulasi Iuran Pekerja Gaji Rp5 Juta Saat Tapera Berlaku https://t.co/Gnn8mX2n63","1268045514739576834","","","in","","7","9","13","https://x.com/CNNIndonesia/status/1268045514739576834","17128975","CNNIndonesia"
"1268043241955323905","Wed Jun 03 04:54:02 +0000 2020","8","Dear Pegawai Udah Siap Gaji Dipotong Lagi 3% Buat Tapera? https://t.co/9C24qS7n0L","1268043241955323905","","","in","Jakarta Capital Region","14","12","17","https://x.com/cnbcindonesia/status/1268043241955323905","847372542830444544","cnbcindonesia"
"1268062369466339328","Wed Jun 03 06:10:02 +0000 2020","822","Jokowi Teken PP Tapera Siap-siap Gaji Pekerja Dipotong untuk Iuran https://t.co/Z2lWerOQQG","1268062369466339328","","","in","","165","389","396","https://x.com/VIVAcoid/status/1268062369466339328","41730943","VIVAcoid"
"1267983523173920769","Wed Jun 03 00:56:44 +0000 2020","28","Buka tuiter pagi ini dapat notif tentang amburadulnya data penerima BLT lagi disatu sisi pemerintah dengan aturan yg berlapis berupaya menguras duit rakyat melalui BPJS dana haji UU No.1 thn 2020 dan yang terbaru perpres tentang Tapera. Rampok koq pake legalitas? Mata duitan!!","1267983523173920769","","","in","Indonesia","1","7","8","https://x.com/wiragaksableng/status/1267983523173920769","52699586","wiragaksableng"
"1268026068172025859","Wed Jun 03 03:45:48 +0000 2020","6","BPJS Kesehatan berjalan penuh carut marut hingga hari ini. Lalu muncul pula Tapera yang tak jelas juntrungannya karena diwajibkan kepada semua pihak. Padahal peruntukkannya ditujukan untuk orang belum punya rumah. Lagi-lagi Pemerintah bermain-main dengan menyedot uang rakyat. https://t.co/1ZO82gG754","1268026068172025859","https://pbs.twimg.com/media/EZju2h3UMAACWo-.jpg","","in","","0","0","5","https://x.com/Gandawan/status/1268026068172025859","147535405","Gandawan"
"1268012437782933504","Wed Jun 03 02:51:38 +0000 2020","0","Nganu nggak diberesin dulu itu Jiwasraya trus beresin Tapera. Baru bikin aturan baru. https://t.co/2llLLf20HE","1268012437782933504","https://pbs.twimg.com/media/EZjiVk4UMAAThVW.jpg","","in","Surakarta, Jawa Tengah","0","0","0","https://x.com/triunt/status/1268012437782933504","51996865","triunt"
"1268049668547608576","Wed Jun 03 05:27:22 +0000 2020","22","Lagi pula pungutan Tapera ini bertentangan dgn semangat Omnibus Law yg kemarin dikoar2kan untuk meningkatkan investasi dan UKM. Jika terlalu banyak pungutan orang jadi malas buka usaha di Indonesia.","1268051628784943104","","PartaiSocmed","in","Indonesia","0","3","15","https://x.com/PartaiSocmed/status/1268051628784943104","869327120","PartaiSocmed"
"1268038289224859648","Wed Jun 03 04:34:21 +0000 2020","7","Pemerintah telah menerbitkan PP Tapera maka seluruh pekerja di negeri ini wajib menjadi peserta dan gajinya akan dipotong 3% per bulan untuk iuran simpanan Tapera. https://t.co/sNXtRsKn3B","1268038289224859648","","","in","Jakarta","5","0","4","https://x.com/KATADATAcoid/status/1268038289224859648","552523769","KATADATAcoid"
"1268031167913050113","Wed Jun 03 04:06:03 +0000 2020","11","Pengusaha keberatan menyetor iuran BP Tapera. Iuran ini untuk mempermudah pekerja memiliki rumah. https://t.co/K1ZrYa7a97","1268031167913050113","","","in","","3","3","4","https://x.com/kumparan/status/1268031167913050113","759692754985242625","kumparan"
"1268077257748168704","Wed Jun 03 07:09:12 +0000 2020","7","VIDEO: Iuran Tapera Aturan Pemerintah Potong Gaji 3 Persen https://t.co/GFLEFLhWy4","1268077257748168704","","","in","","1","0","3","https://x.com/CNNIndonesia/status/1268077257748168704","17128975","CNNIndonesia"
"1267708173445545984","Tue Jun 02 06:42:36 +0000 2020","791","Jokowi Teken PP Tapera Gaji Pekerja Bakal Dipotong Iuran https://t.co/8XC2nStXxQ","1267708173445545984","","","in","","729","552","399","https://x.com/CNNIndonesia/status/1267708173445545984","17128975","CNNIndonesia"
"1267859830510718981","Tue Jun 02 16:45:13 +0000 2020","67","swasta ngejalanin tapera mungkin 2023 kali ya kan 2021 buat asn 2022 buat bumn.","1267859830510718981","","","in","Indonesia","6","20","23","https://x.com/hrdbacot/status/1267859830510718981","501800437","hrdbacot"
