"conversation_id_str","created_at","favorite_count","full_text","id_str","image_url","in_reply_to_screen_name","lang","location","quote_count","reply_count","retweet_count","tweet_url","user_id_str","username"
"1058531635019292674","Sat Nov 03 01:29:43 +0000 2018","91","Acaboooou!!! ESTÁ FEITA A HISTÓRIA! ESTAMOS NOVAMENTE ENTRE AS 04 MELHORES EQUIPES DO FUTSAL GAÚCHO! América/Tapera 00 x 01 AEU/Vip Odontologia/Baklizi ️ Gui Falcão FUTSAL SE GANHA DENTRO DA QUADRA!! COMEMORA TORCIDA MAIS FANÁTICA DO FUTSAL GAÚCHO! A GENTE MERECE! 🇱🇺 https://t.co/6ZcHEcUnpz","1058531635019292674","https://pbs.twimg.com/media/DrCo51mX0AcN7OC.jpg","","pt","Uruguaiana, Brasil","6","0","37","https://x.com/aeuoficial/status/1058531635019292674","779161543506333696","aeuoficial"
"1060935751523803136","Fri Nov 09 16:42:49 +0000 2018","1","A Escola Ponche Verde acaba de estrear com derrota na etapa final dos JERGS 2018 de voleibol infantil o time crissiumalense perdeu por 2 sets a 1 da equipe da Escola Nossa Senhora Imaculada de Tapera. As parciais foram 25/14 e 17/25 e 17/15 no set desempate. https://t.co/0fdNC6CpXH","1060935751523803136","https://pbs.twimg.com/media/DrkzcDSXgAAJL6K.jpg","","pt","","0","0","0","https://x.com/Clecioruver/status/1060935751523803136","156065051","Clecioruver"
"1061057907318579200","Sat Nov 10 00:48:13 +0000 2018","5","Minha mãe e as palavras dela in tapera aiai","1061057907318579200","","","pt","Gramado, Brasil","0","0","0","https://x.com/malu_licks/status/1061057907318579200","4182829169","malu_licks"
"1061982980485341184","Mon Nov 12 14:04:07 +0000 2018","39","Almanaque Brasilidades: 17/11 - Lançamento em São Paulo às 16:30 na Tapera Taperá. Às 14 h darei lá a aula Da costa africana às matas do Brasil . Tomarei como referência a ontologia do caboclo o ser plural e disponível para falar de encantaria catimbó umbandas. (Cont)","1061982980485341184","","","pt","Rio de Janeiro, Brasil","0","3","9","https://x.com/simas_luiz/status/1061982980485341184","296475701","simas_luiz"
"1062657128312266752","Wed Nov 14 10:42:57 +0000 2018","9","70% of customer interactions will be on digital channels- Indranil Das VP Digital Services MEA Ericsson. Whats your organisations digital strategy and focus? #AfricaCom https://t.co/bKeTRJNrrK","1062657128312266752","https://pbs.twimg.com/media/Dr9Q-zhVAAM0hAH.jpg","","en","","0","1","5","https://x.com/TaperaTp/status/1062657128312266752","3434276847","TaperaTp"
"1064301049991827457","Sun Nov 18 23:35:18 +0000 2018","37","Con la ausencia del intendente @CarmeloVidalin y sin apoyo de la @IntendenciaD la 19 Fiesta del @corderopesado fue un exito. @sfa_SdiDelYi Mi Tapera El Fogon @mercados_SUL Frig. San Jacinto https://t.co/zWHcfEXreq","1064301049991827457","https://pbs.twimg.com/media/DsUoEEzXQAASM93.jpg","","es","Sarandí Grande y Durazno","3","1","16","https://x.com/infoaguiar/status/1064301049991827457","1334739584","infoaguiar"
"1062480616447508481","Tue Nov 13 23:01:33 +0000 2018","24","#Africacom heart of digital and technology services. If your bank is not here in CPT then they do not have digital focus. #switchtoStewardBank #switch2kalifekepurple #iot #ai https://t.co/515am0vxVV","1062480616447508481","https://pbs.twimg.com/media/Dr6wej2WoAI_hPA.jpg","","en","","1","0","5","https://x.com/TaperaTp/status/1062480616447508481","3434276847","TaperaTp"
"1063776524149628928","Sat Nov 17 12:51:02 +0000 2018","10","Noite foi fera rolou até uma caminhada do campeche até a tapera sozinho bebado as 4h da manhã","1063776524149628928","","","pt","Florianópolis, Brasil","1","1","0","https://x.com/adrielbre_/status/1063776524149628928","747040052","adrielbre_"
"1061982980485341184","Mon Nov 12 14:05:33 +0000 2018","15","A aula custa R$ 50 (as inscrições estão abertas o espaço é pequeno e as vagas são limitadas) e dá desconto na compra do livro. A Tapera Taperá fica na Galeria Metrópole na Av. São Luiz 187.","1061983340591566848","","simas_luiz","pt","Rio de Janeiro, Brasil","0","1","3","https://x.com/simas_luiz/status/1061983340591566848","296475701","simas_luiz"
"1062102482787143683","Mon Nov 12 21:58:59 +0000 2018","1","Lançamento de Da cidade e do urbano da professora Stella Bresciani na livraria Tapera Taperá em SP. https://t.co/CCnFCuck01","1062102482787143683","https://pbs.twimg.com/media/Dr1YijTWoAYFgDA.jpg","","pt","","0","0","0","https://x.com/Carlao126/status/1062102482787143683","35572349","Carlao126"
"1064302610327453697","Sun Nov 18 23:41:30 +0000 2018","3","não sei oq é mais distante Tapera ou Rio vermelho pqp","1064302610327453697","","","pt","ela/dela","0","2","0","https://x.com/luizzacomz/status/1064302610327453697","1022189426","luizzacomz"
"1063837018243940352","Sat Nov 17 16:51:24 +0000 2018","5","Tá vendo esse grupo aí? Esses torcedores são os primeiros da fila. Saíram de São José da Tapera e chegaram ao Rei Pelé por volta das 11h. 'Motorista da rodada' Silvestre Bezerra lançou o desejo: Tem que ter o acesso hoje. A gente esquece até da distância afirmou. https://t.co/lkKEpbSRgJ","1063837018243940352","https://pbs.twimg.com/media/DsOCHfDXcAAjjy-.jpg","","pt","Maceió","0","0","2","https://x.com/pajucarafutebol/status/1063837018243940352","246355949","pajucarafutebol"
"1060148027950809088","Wed Nov 07 12:32:41 +0000 2018","2","L itinérance apparemment consiste à calmer la colère des retraités en leur promettant qu à l avenir on tapera sur les chômeurs #macron https://t.co/KMR3QZHqFQ","1060148027950809088","https://pbs.twimg.com/media/DrZnAiZX0AUR10C.jpg","","fr","Paris","0","0","2","https://x.com/ChrisLambrt/status/1060148027950809088","1191051684","ChrisLambrt"
"1060294690187161600","Wed Nov 07 22:15:28 +0000 2018","2","Na verdade eu tô com vontade de comer a coxinha que tem numa padaria lá na tapera em floripa puta merda que coxinha. @travadao_de_51 vou aí final de ano e vc vai comigo comer bjs","1060294690187161600","","","pt","xap","0","1","0","https://x.com/dessapasinato/status/1060294690187161600","737139072569872384","dessapasinato"
"1060617792267923456","Thu Nov 08 19:39:21 +0000 2018","3","Botaram um busu grande p tapera nem acredito","1060617792267923456","","","pt","","0","0","0","https://x.com/natashamelo_/status/1060617792267923456","255149177","natashamelo_"
"1057999166604042240","Thu Nov 01 14:13:52 +0000 2018","122","Un tánatos emplumado y criollo El sinfín o trespiés (Tapera naevia) es un ave que habita en los rastrojos y montes de casi todo el país. https://t.co/19ZiB9qC8x","1057999166604042240","https://pbs.twimg.com/ext_tw_video_thumb/1057998933430034434/pu/img/PqFtVUhWZ4_fSB-W.jpg","","es","Bogotá, D.C.","2","5","58","https://x.com/inst_humboldt/status/1057999166604042240","78442816","inst_humboldt"
"1055235762956967936","Wed Oct 24 23:13:05 +0000 2018","4","Guriada minha mae acabou de abrir o bar dps da ponte da tapera (onde era o pesque pague) colem tem sinuca fritas porção de frango cerveja pinga e etc","1055235762956967936","","","pt","São Francisco do Sul, Brasil","0","2","4","https://x.com/ErickMachado047/status/1055235762956967936","958328625274740736","ErickMachado047"
"1056501990631620608","Sun Oct 28 11:04:38 +0000 2018","9","El divendres vàrem veure els resultats de la primera fase del Pla de silvicultura per la prevenció d'incendis forestals de Can Tàpera i Son Ferrer (Palma). Molt bona feina a la Faixa d'autoprotecció. I ja vàrem començar a preparar la segona fase. https://t.co/e1lv4C4k1K","1056501990631620608","https://pbs.twimg.com/media/DqlyHs7XgAEmWHf.jpg","","ca","Baleares, Islas Baleares","0","0","3","https://x.com/Mariapol20/status/1056501990631620608","3706382235","Mariapol20"
"1058431832511909895","Fri Nov 02 18:53:08 +0000 2018","1","Vou pra Tapera assistir o América","1058431832511909895","","","pt","","0","2","1","https://x.com/MatheoSantos10/status/1058431832511909895","3399332181","MatheoSantos10"
"1058451110334205957","Fri Nov 02 20:09:44 +0000 2018","8","Prepare to be disrupted #shosholoza https://t.co/4K2R432RNI","1058451110334205957","https://pbs.twimg.com/media/DrBfpfwWoAMT0Tk.jpg","","en","","0","0","0","https://x.com/TaperaTp/status/1058451110334205957","3434276847","TaperaTp"
"1056865196080332800","Mon Oct 29 11:07:53 +0000 2018","5","Agora os cara aqui na Tapera vão ter que trampar com 5 olheiro a todo vapor né fudeu kkkkkkk","1056865196080332800","","","pt","Tapera, Florianópolis","0","0","1","https://x.com/_0liveirarenan/status/1056865196080332800","818277319966126080","_0liveirarenan"
"1056806966495006720","Mon Oct 29 07:16:29 +0000 2018","26","Relativisons : Je connais Abdelaziz Omari depuis 15 ans. Avec d'autres il a mis en place la section des députés marocains contre la corruption. Je ne sais pas s'il gère bien ou mal sa ville mais je sais qu'il ne touchera pas à l'argent public et ne tapera pas dans caisse. https://t.co/IkdX6sGYrW","1056806966495006720","https://pbs.twimg.com/media/DqqIURyW4AAMI-7.jpg","","fr","Au sud de Mare Nostrum","6","9","7","https://x.com/Meska12/status/1056806966495006720","261831793","Meska12"
"1058479849059291137","Fri Nov 02 22:03:56 +0000 2018","3","Colem no bar da minha mãe hj guriada (dps da ponte da tapera no antigo pesque pague) venha jogar uma sinuca e beber uma cerveja trincando ou uma caipira. Vem que tem porção de fritas e mista tbm!","1058479849059291137","","","pt","São Francisco do Sul, Brasil","1","1","1","https://x.com/ErickMachado047/status/1058479849059291137","958328625274740736","ErickMachado047"
"1053729733521764352","Sat Oct 20 19:28:40 +0000 2018","0","[ Pode turistas na cidade que mora né? sermarbiquini ] . . . #Tapera #Florianopolis #048 em Tapera https://t.co/IT12x5DuoA","1053729733521764352","","","pt","Brasil","0","0","0","https://x.com/ThataaLuz/status/1053729733521764352","164040862","ThataaLuz"
"1058056293657862144","Thu Nov 01 18:00:52 +0000 2018","17","In Entumbane and Nkulumane Bulawayo. Meeting SMEs and informal traders. There is so much Value in the informal system/segments that is supported by disruptive offerings such as the Kwenga POS #Kwenga #itakeswipe @stewardbank https://t.co/oreaM9KZ52","1058056293657862144","https://pbs.twimg.com/media/Dq74kGsXcAEw8FT.jpg","","en","","0","1","8","https://x.com/TaperaTp/status/1058056293657862144","3434276847","TaperaTp"
"1058305015742382080","Fri Nov 02 10:29:12 +0000 2018","8","Kwenga Byo #oversubscribed event #demandoutstripessupply thank you to our customers and merchants including the community for supporting the Steward Bank brand. https://t.co/X0kbxDVCk9","1058305015742382080","https://pbs.twimg.com/media/Dq_ayNxWkAAqV3M.jpg","","en","","0","0","2","https://x.com/TaperaTp/status/1058305015742382080","3434276847","TaperaTp"
"1053790755288952833","Sat Oct 20 23:31:09 +0000 2018","4","Liga Gaúcha de Futsal (Série Ouro) Quartas de final: Uruguaianense x América de Tapera. Que show da torcida da @aeuoficial. Orgulhoso da minha terra. @victorLcosta https://t.co/QfNJGoiT0E","1053790755288952833","https://pbs.twimg.com/ext_tw_video_thumb/1053790236860444672/pu/img/kQQsTOiIVCfOreCi.jpg","","pt","Caxias/Uruguaiana - RS","0","1","0","https://x.com/oeduardocosta/status/1053790755288952833","49311234","oeduardocosta"
"1056964714654253056","Mon Oct 29 17:43:20 +0000 2018","14","A conjuntura da democracia brasileira e o livro COMO A DEMOCRACIA CHEGA AO FIM de David Runciman são os temas do bate-papo da economista @lauraabcarvalho e do professor de filosofia Marcos Nobre dia 9 (sexta-feira) às 19h na Tapera Taperá São Paulo: https://t.co/QGCKQm274Z https://t.co/EX2hsfm97Z","1056964714654253056","https://pbs.twimg.com/media/DqsXv_-XcAEg-Hf.jpg","","pt","Sao Paulo, Brazil","0","0","1","https://x.com/todavialivros/status/1056964714654253056","876819362270908416","todavialivros"
"1057781692180639745","Wed Oct 31 23:49:42 +0000 2018","17","Ahora llovizna así que seguramente los negros que estaban cortando castelli y la 9 de julio deben estar encerrados en la tapera","1057781692180639745","","","es","Resistencia, Chaco","0","0","2","https://x.com/elchaquenioo/status/1057781692180639745","712294396","elchaquenioo"
"1058056912305037313","Thu Nov 01 18:03:20 +0000 2018","14","Something special is about to happen in Bulawayo in the next hour #voiceofthecustomer #customercentric @stewardbank https://t.co/niFlgvrPhW","1058056912305037313","https://pbs.twimg.com/media/Dq75JSfWoAAG8qB.jpg","","en","","0","0","3","https://x.com/TaperaTp/status/1058056912305037313","3434276847","TaperaTp"
"1056789690169339904","Mon Oct 29 06:07:50 +0000 2018","6","I learnt from someone that you don t just aspire to make a Living aspire to make a Difference. And it s not how much you have it s what you do with what you have... https://t.co/cTkDfVWndJ","1056789690169339904","https://pbs.twimg.com/media/Dqp4nIMWsAA9Eb3.jpg","","en","Ivory Coast","0","1","0","https://x.com/TJMuzira/status/1056789690169339904","232270183","TJMuzira"
"1058073269952233472","Thu Nov 01 19:08:20 +0000 2018","22","Steward Bank Platinum Club centre is now officially opened #kalifekepurple @stewardbank @DrMambondiani https://t.co/7hoaXAw9qv","1058073269952233472","https://pbs.twimg.com/media/Dq8H5wmX0AktCul.jpg","","en","","1","0","6","https://x.com/TaperaTp/status/1058073269952233472","3434276847","TaperaTp"
"1056990351033020418","Mon Oct 29 19:25:12 +0000 2018","3","isso é tão absurdamente tapera taperá que se ficar mais tapera taperá vai acabar com um sarau de poesia erótica num apartamento no copan","1056990351033020418","","","pt","Sao Paulo, Brazil","0","1","1","https://x.com/fvguima/status/1056990351033020418","95966522","fvguima"
"1057154894401101825","Tue Oct 30 15:56:57 +0000 2018","19","@Mediapart Globalement Plenel tapera sur FI jusqu'aux Européennes en espérant un transfert de voix vers le benêt. Les rois de la posture sans une once de volonté de s'attaquer au capitalisme.","1057300333435781121","","Mediapart","fr","Dijon, France","0","5","12","https://x.com/Hyeneinsoumise/status/1057300333435781121","858683949299761152","Hyeneinsoumise"
"1054251274319814656","Mon Oct 22 06:01:05 +0000 2018","0","PUPR targetkan pembentukan BP Tapera rampung di 2019 https://t.co/dzfp2zHp36","1054251274319814656","","","in","Indonesia","1","0","0","https://x.com/merdekadotcom/status/1054251274319814656","456426648","merdekadotcom"
"1051593605155094529","Sun Oct 14 22:00:27 +0000 2018","3","Etwell Tapera (SID): I support document for 4 reasons including if we cannot abide by our policies who do we expect to abide by the message that we preach? #GCAC18","1051593605155094529","","","en","Silver Spring, MD","0","1","1","https://x.com/ARMcChesney/status/1051593605155094529","26966716","ARMcChesney"
"1053298630025768960","Fri Oct 19 14:55:37 +0000 2018","1","Eu e as meninas estamos indo la pra casa da tapera","1053298630025768960","","","pt","Florianópolis, Brasil","0","0","1","https://x.com/Day_kailaine/status/1053298630025768960","940355821631918080","Day_kailaine"
"1053328430408839168","Fri Oct 19 16:54:02 +0000 2018","1","Saudades Tapera","1053328430408839168","","","pt","Brasil","0","0","2","https://x.com/JuRibeiro1414/status/1053328430408839168","736674326162870276","JuRibeiro1414"
"1049690546602733569","Tue Oct 09 15:58:23 +0000 2018","4","registro chave da semana passada na feira de literatura marginal da tapera taperá com vários aliado trampando vários outros organizando vamo dominar o mundo https://t.co/XLklFrKv2T","1049690546602733569","https://pbs.twimg.com/media/DpE_-urX4AEl_rX.jpg","","pt","+55011 Capão","0","0","0","https://x.com/marabu_____/status/1049690546602733569","237322758","marabu_____"
"1046883976173039618","Mon Oct 01 22:06:04 +0000 2018","2","Quase nunca entro no tuinto mas amanhã começa curso novo na Tapera Taperá e ainda tem vagas e vamos e zás! https://t.co/WbAxKGInZt","1046883976173039618","https://pbs.twimg.com/media/DodBS9KWwAEZR2j.jpg","","pt","são paulo","0","0","1","https://x.com/jcallegari/status/1046883976173039618","15024624","jcallegari"
"1048271725522239497","Fri Oct 05 18:00:29 +0000 2018","9","Henri Crutchet (au centre) tapera le coup d envoi fictif d #ABUSON accompagné de Xabi Valdivielso président de la section tennis de l AB https://t.co/WkQnud4p5O","1048271725522239497","https://pbs.twimg.com/media/Dow1kmcXoAUT_-u.jpg","","fr","Bayonne","2","0","2","https://x.com/avironrugbypro/status/1048271725522239497","202234178","avironrugbypro"
"1050873082460741637","Fri Oct 12 22:17:21 +0000 2018","2","vou ter q me esconder na tapera eh isto","1050873082460741637","","","pt","","0","0","0","https://x.com/lisboa_johan/status/1050873082460741637","1894960248","lisboa_johan"
"1053401082146287616","Fri Oct 19 21:42:43 +0000 2018","0","Capas pinte tapera está nooche ","1053401082146287616","","","es","Venado Tuerto, Argentina","0","0","0","https://x.com/JulaaGrecoo/status/1053401082146287616","2984507643","JulaaGrecoo"
"1049465277090619392","Tue Oct 09 01:03:14 +0000 2018","5","Jugando al truco en la Tapera perdí una carta y me la guardaron. https://t.co/376RJYD1XV","1049465277090619392","https://pbs.twimg.com/media/DpBzGbbWsAIWrxI.jpg","","es","","0","0","0","https://x.com/withoutcare__/status/1049465277090619392","601529463","withoutcare__"
"1052802879172632576","Thu Oct 18 06:05:41 +0000 2018","0","Tive que ir pra bolsa da residência pedagógica na tapera como faço a toda quarta a um mês aí tá só que eu não dormi noite passada e n sei onde tava com a cabeça","1052802879172632576","","","pt","Florianópolis, Santa Catarina","0","0","0","https://x.com/retisabroering/status/1052802879172632576","721500146782072832","retisabroering"
"1049745275303153664","Tue Oct 09 19:35:51 +0000 2018","3","#Florianopolis #Tapera https://t.co/2y0Cugp3IU","1049745275303153664","https://pbs.twimg.com/media/DpFxwk9W4AAF-Kk.jpg","","qme","Florianópolis, SC Brazil","1","0","0","https://x.com/MonitoramentoSC/status/1049745275303153664","709823520017141761","MonitoramentoSC"
"1048338182310383617","Fri Oct 05 22:24:34 +0000 2018","7","La veillée des saints n'est pas encore là que des créatures bizarres ont déjà pointé le bout de leur nez au Convent des Fous. Brrrrrr !!! Planquez les pieds sous les couettes et vérifiez sous les lits ! Qui sait qui tapera à votre porte prochainement... #ffxivsnaps #FF14 https://t.co/0WKP9wPJPx","1048338182310383617","https://pbs.twimg.com/media/Doxx5JJX0AEg62g.jpg","","fr","Somewhere in Eorzea.","0","0","1","https://x.com/Killa_kira_/status/1048338182310383617","969115140934324224","Killa_kira_"
"1050367715775586304","Thu Oct 11 12:49:12 +0000 2018","25","São Gabriel 8 x 1 Tapera","1050367715775586304","","","pt","","0","1","0","https://x.com/nnniiiccccc/status/1050367715775586304","831946877486637056","nnniiiccccc"
"1052027293701496837","Tue Oct 16 02:43:47 +0000 2018","2","[15/10 23:42] Samira : Mano um mês da Tapera [15/10 23:42] Samira : Sepa foi ontem [15/10 23:42] Samira : Nossa vou formar amanhã já [15/10 23:43] Vitinho: Se pá [15/10 23:43] Vitinho: Foi memo [15/10 23:43] Vitinho: Pqp","1052027293701496837","","","pt","Khlong Se, Thailand","0","0","0","https://x.com/zizian04/status/1052027293701496837","1034557039878582273","zizian04"
"1050138004881383425","Wed Oct 10 21:36:25 +0000 2018","4","fazer drift é fácil quero ver dirigir na tapera","1050138004881383425","","","pt","Tapera","0","2","1","https://x.com/planet_rezende/status/1050138004881383425","821818780754046976","planet_rezende"
"1052199245481160706","Tue Oct 16 14:07:03 +0000 2018","4","- onde vc mora? - moro na Tapera e ja te vi no ônibus já te vi por lá tavas na fila tal dia eu conheço você e eu NUNCA vi esse @ na vida KKKKKKKKKKKK COMO ASSIM MDS https://t.co/dtip3JbJ6Z","1052199245481160706","https://pbs.twimg.com/tweet_video_thumb/Dpopk13UwAAOWPZ.jpg","","pt","Florianópolis, Brasil","0","2","1","https://x.com/costtanath/status/1052199245481160706","792797597341741056","costtanath"
"1053085134377943040","Fri Oct 19 00:47:16 +0000 2018","0","Aonde tu mora? na tapera https://t.co/OQJrYZWtFm","1053085134377943040","","","pt","natália 💙","0","0","0","https://x.com/falamoura/status/1053085134377943040","1476322610","falamoura"
"1053661448390561792","Sat Oct 20 14:57:20 +0000 2018","4","pega busão na tapera com o cobrador de juju nvs","1053661448390561792","","","pt","Florianópolis, Brasil","0","1","0","https://x.com/ru1v1nhha/status/1053661448390561792","2924525359","ru1v1nhha"
"1051305547989954562","Sun Oct 14 02:55:49 +0000 2018","1","Birrita en la tapera con los pibes","1051305547989954562","","","es","Venado Tuerto, Argentina","0","0","0","https://x.com/DavidDiazz46/status/1051305547989954562","910510149852368897","DavidDiazz46"
"1052367426040594432","Wed Oct 17 01:15:21 +0000 2018","1","Posso morar cm alguém? Minha mae alugou la na tapera","1052367426040594432","","","pt","São Francisco do Sul, Brasil","0","2","0","https://x.com/ErickMachado047/status/1052367426040594432","958328625274740736","ErickMachado047"
"1042772970756874240","Thu Sep 20 13:50:24 +0000 2018","55","Polícia Militar realiza operação em todo o Estado até o final de semana para reprimir a venda de drogas no varejo para sufocar o tráfico de entorpecentes. Operação Xeque-Mate começou hoje na Tapera. Video: divulgação PMSC https://t.co/5s1ZenfZsK","1042772970756874240","https://pbs.twimg.com/ext_tw_video_thumb/1042772843543621638/pu/img/2uEAJCzCssBA7lIb.jpg","","pt","Florianópolis, SC","1","3","12","https://x.com/CBNFloripa/status/1042772970756874240","239951385","CBNFloripa"
"1044214810940968961","Mon Sep 24 13:19:46 +0000 2018","14","Gente o velório da bi vai ser no centro comunitário da Tapera 13:00. Quem puder ir dar uma força ficaria muito grata! ","1044214810940968961","","","pt","Tapera, Florianópolis","0","0","2","https://x.com/evelyn_loiraa/status/1044214810940968961","2520682506","evelyn_loiraa"
"1046866961953697792","Mon Oct 01 20:58:28 +0000 2018","11","A expectativa de integridade física de um juiz do interior de MT é baixa principalmente os que estão no norte do Estado onde o fórum é uma tapera com wi-fi","1046866961953697792","","","pt","","0","0","2","https://x.com/iuris_man/status/1046866961953697792","60937801","iuris_man"
"1042643201952235520","Thu Sep 20 05:14:45 +0000 2018","2","Que venha a de Tapera!!","1042643201952235520","","","pt","Macaé","1","0","0","https://x.com/ReisThaylanni/status/1042643201952235520","810335452574191616","ReisThaylanni"
"1044063877753966598","Mon Sep 24 03:20:00 +0000 2018","1","Va insta y tw nomas jajaja tapera wsp","1044063877753966598","","","es","Helvecia","2","0","2","https://x.com/Azzzul2/status/1044063877753966598","716367809224245248","Azzzul2"
"1045683706973773825","Fri Sep 28 14:36:38 +0000 2018","2","「Dreams of The Future (Original Mix)」 by Yarik Djan 〜「Tapera」 Astor Piazzolla #ckpirate https://t.co/GyeE1yuYZE","1045683706973773825","https://pbs.twimg.com/media/DoMDr0OUwAE_cnl.jpg","","en","Japan｜Tokyo","0","0","1","https://x.com/Hewmoon/status/1045683706973773825","59527204","Hewmoon"
"1043281810682077184","Fri Sep 21 23:32:21 +0000 2018","1","Os piratas na tapera hoje pqp","1043281810682077184","","","pt","Trajano de Moraes ","0","0","1","https://x.com/Freitasfelipe16/status/1043281810682077184","880560775420575744","Freitasfelipe16"
"1044562804576059392","Tue Sep 25 12:22:34 +0000 2018","3","6 real um salgado aqui no trampo ta louco kk na tapera eh 1 50 e eh bem melhor to puto kkk","1044562804576059392","","","pt","Tapera, Florianópolis","0","0","0","https://x.com/taomurilo/status/1044562804576059392","273095769","taomurilo"
"1043228638622220288","Fri Sep 21 20:01:04 +0000 2018","19","estava no ponto de ônibus distraída quando ouvi um barulho de buzina muito longo logo pensei macho escroto quando olhei p outro lado da rua era o meu pai fazendo tapera/titri kkkkkkkkkkkkkkkkkkkkkk","1043228638622220288","","","pt","","0","0","0","https://x.com/kushtss/status/1043228638622220288","2407507249","kushtss"
"1045681448999518208","Fri Sep 28 14:27:39 +0000 2018","7","Astor Piazzolla - Tapera (1947) https://t.co/Bnvdn4TXS2 #ckpirate","1045681448999518208","","","it","小江戸","0","0","0","https://x.com/arappocaro/status/1045681448999518208","4122461","arappocaro"
"1045826629807886336","Sat Sep 29 00:04:33 +0000 2018","1","que ganas de papas con cheddar y una birrita en la tapera","1045826629807886336","","","es","","0","0","0","https://x.com/KiaraDiscalzo/status/1045826629807886336","1355081323","KiaraDiscalzo"
"1046093833581334528","Sat Sep 29 17:46:20 +0000 2018","6","Venham para o Tapera Taperá na Galeria Metrópole para o Podcasts em Debate !!! https://t.co/yT75j6KuzY","1046093833581334528","https://pbs.twimg.com/ext_tw_video_thumb/1046093757773467648/pu/img/_xJBGnBbqxUC2Vu2.jpg","","pt","Brasil e Portugal","0","1","3","https://x.com/TLIOpodcast/status/1046093833581334528","901195408847892484","TLIOpodcast"
"1044205365091553283","Mon Sep 24 12:42:14 +0000 2018","18","O velório da bibi vai ser hoje as 14:00 horas aqui no centro comunitário da tapera pra quem quiser comparecer deixo o recado","1044205365091553283","","","pt","","0","0","4","https://x.com/B_goodoy/status/1044205365091553283","872120721920724992","B_goodoy"
"1043585482343497729","Sat Sep 22 19:39:02 +0000 2018","6","Que festa fizemos em São José da Tapera e Olivença!! Muito bom encontrar o povo animado pelas ruas! Por aqui muita coisa chegou. Mas o povo e a gente sabe que ainda há muito o que fazer! Estou pronto para trabalhar mais!! https://t.co/gIEi1B2UgY","1043585482343497729","https://pbs.twimg.com/media/DnuPdH8W4AAiZz5.jpg","","pt","Maceió, Alagoas, Brasil","0","0","1","https://x.com/RenanFilho_/status/1043585482343497729","176502945","RenanFilho_"
