"conversation_id_str","created_at","favorite_count","full_text","id_str","image_url","in_reply_to_screen_name","lang","location","quote_count","reply_count","retweet_count","tweet_url","user_id_str","username"
"1138901687085752321","Wed Jun 12 20:11:36 +0000 2019","9","Del 13 al 15 de junio te esperamos en nuestro stand de @Feriaprolesa para discutir y pensar juntos las mejores opciones de cultivos de verano y aprovechar nuestras promos especiales por la Feria! Estamos en la Sociedad Criolla Mi Tapera ruta 11 km 88 500 Santa Lucía.@Prolesa_uy https://t.co/fvYFOg8qxh","1138901687085752321","https://pbs.twimg.com/ext_tw_video_thumb/1138899743780855810/pu/img/0q8bT1fhFaR_4T2W.jpg","","es","Cuareim 1958, Montevideo","0","0","2","https://x.com/PGGWrightson_UY/status/1138901687085752321","351763088","PGGWrightson_UY"
"1143784135049302022","Wed Jun 26 07:32:42 +0000 2019","47","Proud to be part of the National Coordinating Committee that will see #Zimbabwe participate at Expo 2020 Dubai. What will you tell the world about Zimbabwe? @PTChimusoro @MarketersZim @InfoMinZW @METHI_Zimbabwe #brandZimbabwe https://t.co/Df9HpWX6z5","1143784135049302022","https://pbs.twimg.com/ext_tw_video_thumb/1143783664679038976/pu/img/K3ljskHlh7fF37YJ.jpg","","en","Global","3","8","9","https://x.com/CynthiaTapera/status/1143784135049302022","1117405263164780546","CynthiaTapera"
"1144017812932968449","Wed Jun 26 23:01:16 +0000 2019","10","Carianos Costeira Campeche Morro das pedras Tapera Saco dos limões Armacao Centro Ribeirão ","1144017812932968449","","","pt","Floripa","0","3","0","https://x.com/gabrielreinertt/status/1144017812932968449","2292832439","gabrielreinertt"
"1144052285829505024","Thu Jun 27 01:18:15 +0000 2019","5","vai se fude mexer no tapera via tunel quem foi o arrombado não guenta 5 min de porrada cmg","1144052285829505024","","","pt","natália 💙","1","1","0","https://x.com/falamoura/status/1144052285829505024","1476322610","falamoura"
"1143430016518230021","Tue Jun 25 08:05:34 +0000 2019","115","J'essaie de parler au max en espagnol à Yaël comme ça a l'école il se tapera des grands 19 de moyenne comme sa maman ️","1143430016518230021","","","fr","La Piraterie 🏴‍☠️","0","2","1","https://x.com/Shinkensen_/status/1143430016518230021","1002398485","Shinkensen_"
"1140687081389383680","Mon Jun 17 18:26:07 +0000 2019","26","Mc poze confirmado na tapera dia 5 de julho logo mas sai o video dele anunciando!! Brota ","1140687081389383680","","","pt","Tapera, Florianópolis","0","2","10","https://x.com/taomurilo/status/1140687081389383680","273095769","taomurilo"
"1136961905241853954","Fri Jun 07 11:43:36 +0000 2019","0","O cidadão se fantasiou de lobisomem em São José da Tapera/AL pra assustar o povo HUEHEUEHE Parece coisa do @naosalvo https://t.co/7P1orrTOX9","1136961905241853954","https://pbs.twimg.com/ext_tw_video_thumb/1136961860320862208/pu/img/o50HFm8hiniTm4xy.jpg","","pt","Maceió/AL - Brasil","0","1","1","https://x.com/CelioOliveira92/status/1136961905241853954","83735352","CelioOliveira92"
"1143138179064766465","Mon Jun 24 12:45:55 +0000 2019","10","Anoche en el cierre de campaña y el hermoso reconocimiento que nos hicieron a los que militamos con el corazón para ver a LUIS presidente la Tapera presente.ARRIBA LA 71!!!!! https://t.co/I5Uyok4mDi","1143138179064766465","https://pbs.twimg.com/media/D90-Gm7WsAA8mdz.jpg","","es","","2","0","7","https://x.com/Elizabe03563748/status/1143138179064766465","1130569923611320320","Elizabe03563748"
"1143327210356596738","Tue Jun 25 01:17:03 +0000 2019","3","Time da.Tapera vemm.aie.kkkkkkkk. @Douglas_Madrug_ @bruno22317 @are_bomba de novo ","1143327210356596738","","","pt","piratini","0","2","0","https://x.com/Z10Zluis/status/1143327210356596738","2369706541","Z10Zluis"
"1144057816988213250","Thu Jun 27 01:40:13 +0000 2019","3","o tanto q eu to rindo imaginando a amanda e a nicolli parando na tapera/tirio por causa da mudança dos lugares dos ônibus kkkkkkkkkkkkkkkkkkkkkkkkkkkkkk","1144057816988213250","","","pt","Florianópolis, Brasil","0","2","1","https://x.com/andrssar/status/1144057816988213250","2649399474","andrssar"
"1143482647752171526","Tue Jun 25 11:34:42 +0000 2019","14","@zimagricsociety CEO speaks to media on the transition from #HarareAgricShow to Zimbabwe Agricultural Show @MudhumeniMukuru @ndaka_majaka @263Chat @FingazLive @DailyNewsZim https://t.co/0bx2ViOot7","1143482647752171526","https://pbs.twimg.com/media/D953Y8LXsAAN6Qg.jpg","zimagricsociety","en","Global","1","0","8","https://x.com/CynthiaTapera/status/1143482647752171526","1117405263164780546","CynthiaTapera"
"1144065298678632448","Thu Jun 27 02:09:57 +0000 2019","37","Eu com 22 anos já fui para: Soledade Mormaço Anta Gorda Barros Cassal Ibirapuitã Fontoura Xavier São José do Herval Tunas Alto Alegre Espumoso Tapera Campos Borges Jacuízinho Lagoão Salto do Jacuí Tio Hugo Ernestina Itapuca Nova Alvorada Arvorezinha E a capital Passo Fundo","1144065298678632448","","","pt","Soledade, Brasil","2","6","0","https://x.com/nayamfranco/status/1144065298678632448","543623172","nayamfranco"
"1143495895851446272","Tue Jun 25 12:27:21 +0000 2019","16","#RedShoeTuesday In the spirit of womanhood and in honor of the amazing women who have led the way in business. @pattymaps @ndaka_majaka @MoeChanda @IOD_Zimbabwe @BTonhodzayi @KudzieChimzy @RedShoeMovement https://t.co/UYrMh7W644","1143495895851446272","https://pbs.twimg.com/media/D96DMXxX4AAVFTz.jpg","","en","Global","2","1","8","https://x.com/CynthiaTapera/status/1143495895851446272","1117405263164780546","CynthiaTapera"
"1143905635291029504","Wed Jun 26 15:35:30 +0000 2019","3","Com 18 anos ja fui para: *Enseada *Tapera *Marjoca *forte *Miranda *Laranjeira","1143905635291029504","","","pt","São Francisco do Sul, Brasil","0","1","0","https://x.com/Nathanael_doug/status/1143905635291029504","960338030786736129","Nathanael_doug"
"1143484588330631170","Tue Jun 25 11:42:25 +0000 2019","9","PIMP MY BRAND...get the latest ZimMarketer to find out more about the rebranding of #HarareAgricShow to #ZimAgriShow @MarketersZim @MudhumeniMukuru @JohnDe90979343 @basera_john @tavmanj https://t.co/sDaFMupIPO","1143484588330631170","https://pbs.twimg.com/media/D955JR_WsAMPLsv.jpg","","en","Global","0","0","3","https://x.com/CynthiaTapera/status/1143484588330631170","1117405263164780546","CynthiaTapera"
"1143690499863339008","Wed Jun 26 01:20:38 +0000 2019","6","doq adianta curti meu tweet se nao que namora cmg pra nois dividir uma kit net na tapera","1143690499863339008","","","pt","natália 💙","0","0","0","https://x.com/falamoura/status/1143690499863339008","1476322610","falamoura"
"1143455001714577409","Tue Jun 25 09:44:51 +0000 2019","7","It s more than just a revamped logo it s about elevating the experience of our patrons partners and exhibitors. Unveiling the #Zimbabwe Agricultural Show to the media this afternoon good bye #HarareAgricShow its time to truly reflect our national character #agriculture https://t.co/yzjx12bymt","1143455001714577409","https://pbs.twimg.com/media/D95eCuwXUAANWxh.jpg","","en","Global","1","0","0","https://x.com/CynthiaTapera/status/1143455001714577409","1117405263164780546","CynthiaTapera"
"1140048249841172481","Sun Jun 16 00:07:38 +0000 2019","7","Mc poze na tapera iiiii vai pega preço kkkkk","1140048249841172481","","","pt","Tapera, Florianópolis","0","0","0","https://x.com/taomurilo/status/1140048249841172481","273095769","taomurilo"
"1141057908597231616","Tue Jun 18 18:59:39 +0000 2019","25","Congratulations to @stewardbank VISA Transact &amp; Win promotion winner Mr Phillip Nyapokoto on winning a trip for two to the Total 2019 Africa Cup of Nations in Egypt. #Gobettroter https://t.co/F9hhIx3mSh","1141057908597231616","https://pbs.twimg.com/media/D9XaF5sWsAQP_Hu.jpg","","en","","0","0","4","https://x.com/TaperaTp/status/1141057908597231616","3434276847","TaperaTp"
"1136825093517168641","Fri Jun 07 02:54:40 +0000 2019","271","AGORA | Avistamentos em Santo Ângelo Cruz Alta Estrela Quarai Soledade Terra de Areia Caxias do Sul Erechim Almirante Tamandaré do Sul Alegrete Guaíba Tapera Canoas Ijuí Manoel Viana Tupanciretã Passo Fundo Venâncio Aires Sapucaia do Sul Pejuçara Marau etc. https://t.co/UZDPe6875O","1136828796206796805","https://pbs.twimg.com/ext_tw_video_thumb/1136828762987933698/pu/img/2MfnCzi63MRBoHxi.jpg","metsul","pt","Brasil ","31","22","99","https://x.com/metsul/status/1136828796206796805","26416363","metsul"
"1134270284171796480","Fri May 31 01:28:04 +0000 2019","34","es mucho pedir que vuelva a abrir la tapera?","1134270284171796480","","","es","Venado Tuerto","1","1","18","https://x.com/MartuPuyrredon1/status/1134270284171796480","1961151181","MartuPuyrredon1"
"1131649467306971136","Thu May 23 19:53:52 +0000 2019","11","Salimos a dar una vuelta por el campo y paramos en una tapera a pedir mandarinas y ahí fue donde conocí al MARTILLO ROLDÁN UN MAESTRO DEL BOXEO https://t.co/xyeoxqX3xS","1131649467306971136","https://pbs.twimg.com/media/D7RtLcqWkAELBmF.jpg","","es","Freyre.córdoba ","0","0","0","https://x.com/FeerRamiirez2/status/1131649467306971136","1021416255130042368","FeerRamiirez2"
"1131254894822871046","Wed May 22 17:45:59 +0000 2019","1","É hoje: logo mais às 19h Guilherme Gontijo Flores autor de HISTÓRIA DE JOIA e o poeta Tarso de Melo conversam sobre o romance na Tapera Taperá em São Paulo. Saiba mais: https://t.co/zv3DBIeKVy https://t.co/WYzubjtuMI","1131254894822871046","https://pbs.twimg.com/ext_tw_video_thumb/1131248485335019520/pu/img/Bbc8_DsKX49VGwrz.jpg","","pt","Sao Paulo, Brazil","0","0","0","https://x.com/todavialivros/status/1131254894822871046","876819362270908416","todavialivros"
"1129116188905299973","Thu May 16 20:07:32 +0000 2019","4","BUSÃO BUGOU E NÃO DEIXOU SAIR NINGUÉM tapera via túnel fdd https://t.co/7k1eqDJsEX","1129116188905299973","https://pbs.twimg.com/media/D6ttAwKXYAESsny.jpg","","pt","Floripa","0","0","1","https://x.com/mathlombe/status/1129116188905299973","2799104255","mathlombe"
"1131318193270722562","Wed May 22 21:57:30 +0000 2019","2","Tenho algum seguidor de Fortaleza? Estou aqui pela primeira vez pra fazer shows na região gravações em estúdio e estou envolvido num projeto lindo chamado Tapera das Artes. Ontem fiz show acústico no museu da fotografia https://t.co/v6xSlmBdts","1131318193270722562","https://pbs.twimg.com/media/D7M_5oMWwAEkU-n.jpg","","pt","São Paulo, Brasil","0","0","1","https://x.com/Seadi/status/1131318193270722562","575520073","Seadi"
"1134500332866822145","Fri May 31 16:42:12 +0000 2019","9"," Inauguració de l'exposició 'Dones del suro: treball i societat' . La podeu visitar a Can Trinxeria i podeu descobrir el treball de les dones a la indústria tapera https://t.co/qgMs7dRcUf","1134500332866822145","https://pbs.twimg.com/media/D76N9TNWwAAgBJv.jpg","","ca","Cassà de la Selva, España","1","0","3","https://x.com/firadeltap/status/1134500332866822145","829646057357324288","firadeltap"
"1134039209898065920","Thu May 30 10:09:51 +0000 2019","6","Estou na ong Tapera das Artes em Aquiraz/CE desde a semana passada fazendo um trabalho com eles aqui. É emocionante ver eles cantando minhas músicas. Obrigado pela oportunidade! #ong https://t.co/SR7ouVTUSe","1134039209898065920","https://pbs.twimg.com/ext_tw_video_thumb/1134039072576548865/pu/img/gH7uYROQ59kPHgNW.jpg","","pt","São Paulo, Brasil","0","0","1","https://x.com/Seadi/status/1134039209898065920","575520073","Seadi"
"1133764656550559744","Wed May 29 15:58:53 +0000 2019","41","mon fils il s habille comme ça je sors direct l appareil photo et on se tapera les meilleurs shootings","1133764656550559744","","","fr","Luxembourg","0","0","6","https://x.com/enlacement/status/1133764656550559744","171421804","enlacement"
"1134120178403463168","Thu May 30 15:31:36 +0000 2019","3","Peguei o bus e fiquei viajando Fui parar no fim da tapera ","1134120178403463168","","","pt","","1","3","0","https://x.com/maiiathalia/status/1134120178403463168","875364007032619009","maiiathalia"
"1132309142717292544","Sat May 25 15:35:11 +0000 2019","1","Logo mais partiu tapera... @Jacksoncdias ","1132309142717292544","","","pt","Tio Hugo ","0","1","0","https://x.com/MicaelGroth08/status/1132309142717292544","622818943","MicaelGroth08"
"1134488239522373636","Fri May 31 15:54:08 +0000 2019","22","Desmilitarizar. Lançamento do livro de Luiz Eduardo Soares. Hoje 31 de maio as 19hs na Livraria Tapera Taperá. Avenida São Luiz 187 2* andar. https://t.co/5il26GVLcS","1134488239522373636","https://pbs.twimg.com/media/D76DCTTX4AEqxxm.jpg","","pt","","0","0","8","https://x.com/pauloteixeira13/status/1134488239522373636","25562342","pauloteixeira13"
"1136249763869986816","Wed Jun 05 12:33:48 +0000 2019","10","@ the National Environment Forum 2019. Call to action- Protect natural environments wildlife and natural resources @theGEF @BishowParajuli I see you @InfoMinZW https://t.co/jahwbqBusG","1136249763869986816","https://pbs.twimg.com/ext_tw_video_thumb/1136249651328442368/pu/img/2SatnGCi17ohg4Hk.jpg","","en","Global","0","1","3","https://x.com/CynthiaTapera/status/1136249763869986816","1117405263164780546","CynthiaTapera"
"1133939427909296129","Thu May 30 03:33:21 +0000 2019","6","Cada vez essa nossa turma da Tapera fica mais única","1133939427909296129","","","pt","Rio Grande, Brasil","0","1","0","https://x.com/Douglas_Madrug_/status/1133939427909296129","800842225513009152","Douglas_Madrug_"
"1132577188660883457","Sun May 26 09:20:18 +0000 2019","0","Deus o livre que volta no mundo ontem de Tio Hugo a Tapera de Tapera a Soledade e de soledade pro bailão de kerp no interior! Bote massa","1132577188660883457","","","pt","Tio Hugo ","0","0","0","https://x.com/MicaelGroth08/status/1132577188660883457","622818943","MicaelGroth08"
"1134972395314438144","Sat Jun 01 23:58:00 +0000 2019","1","Tapera tá alagada","1134972395314438144","","","pt","Florianópolis, Brasil","0","0","0","https://x.com/adrielbre_/status/1134972395314438144","747040052","adrielbre_"
"1130583718236708864","Mon May 20 21:18:58 +0000 2019","4","Pedi pra mãe me faze uma comida quá tomei uma tapera hahahahaha","1130583718236708864","","","pt","Horizontina, Brasil","0","0","0","https://x.com/Artur_tule/status/1130583718236708864","884230192956420096","Artur_tule"
"1130905008139055105","Tue May 21 18:35:39 +0000 2019","4","Amanhã quarta-feira (22) às 19h Guilherme Gontijo Flores lança seu romance HISTÓRIA DE JOIA na Tapera Taperá (SP) em bate-papo com o poeta Tarso de Melo. Saiba mais: https://t.co/zv3DBIeKVy https://t.co/VDnQDVHm3x","1130905008139055105","https://pbs.twimg.com/media/D7HE8CQW0AEJAGN.jpg","","pt","Sao Paulo, Brazil","0","0","1","https://x.com/todavialivros/status/1130905008139055105","876819362270908416","todavialivros"
"1131697027853758464","Thu May 23 23:02:52 +0000 2019","6","La semana pasada recorrimos La Tapera otro campo de Yabito S.A ubicado en Curuzu Cuatia República de Corrientes. Es un campo destinado a cría y a la reposición de las hembras 1⃣ En la foto se observan las terneras seleccionadas para reposición pastoreando campo natural https://t.co/lwS4RS14GI","1131697027853758464","https://pbs.twimg.com/media/D7SYb3pXYAU0wm2.jpg","","es","","0","1","1","https://x.com/ElizaldeRiffel/status/1131697027853758464","1008747859456462848","ElizaldeRiffel"
"1130634697707593728","Tue May 21 00:41:32 +0000 2019","0","Não sei o que faço dia 8 fico em Roque e vou na Primme ou vou pra Tapera e vou na Rust ","1130634697707593728","","","pt","Roque Gonzales","0","1","0","https://x.com/dudabeppler_/status/1130634697707593728","2538128488","dudabeppler_"
"1127697996316065794","Sun May 12 22:12:08 +0000 2019","11","essa é Marilena Vilaça socióloga e historiadora. Atualmente licenciada da universidade onde doutr... ensina pode ser vista em palestras na FFLCH e debates do Tapera Taperá. É fã de Angela Ro Ro mas secretamente ouve Ana Carolina. Acompanhem os stories dela no meu Instagram rs https://t.co/zNiV6CtSdN","1127697996316065794","https://pbs.twimg.com/ext_tw_video_thumb/1127697873636864000/pu/img/tWxjwL5y1xFkLK67.jpg","","pt","","1","0","0","https://x.com/_pedrofernandes/status/1127697996316065794","17855172","_pedrofernandes"
"1126366548942381057","Thu May 09 06:01:26 +0000 2019","0","É hoje !! Tapera Taperá https://t.co/S84sqQkv52","1126366548942381057","https://pbs.twimg.com/media/D6GoZq-XkAACD9E.jpg","","pt","","0","0","0","https://x.com/therezafontoura/status/1126366548942381057","167999129","therezafontoura"
"1128959337328709633","Thu May 16 09:44:15 +0000 2019","6","After 124 yrs of existence Zimbabwe's biggest annual agricultural gathering is rebranding- from Harare Agricultural Show to Zimbabwe Agricultural Show. Watch this space #agriculture https://t.co/JuisQTAL3F","1128959337328709633","https://pbs.twimg.com/ext_tw_video_thumb/1128958938517577733/pu/img/Y_zBbLz4FukggEAH.jpg","","en","Global","1","0","3","https://x.com/CynthiaTapera/status/1128959337328709633","1117405263164780546","CynthiaTapera"
"1124402400813514754","Fri May 03 19:56:37 +0000 2019","81","meus pais mandando foto felicíssimos viajando sozinhos pela grécia aí penso que os dois nasceram numa tapera réia no interior do maranhão e meu deus eu n tenho psicológico pra isso vo chorar pois lindos d++++ https://t.co/GvpFxImPlM","1124402400813514754","https://pbs.twimg.com/media/D5qt_YsXkAEx0x7.jpg","","pt","Brasília ","1","17","0","https://x.com/pamoraes_/status/1124402400813514754","111624347","pamoraes_"
"1126065132633767936","Wed May 08 10:03:43 +0000 2019","90"," Donde el aire perfumado de risas escrito y donde en cada pastito hay un recuerdo clavado; tapera que mi pasado con colores de amapola entusiasmada enarbola y que siempre que la miro dejo sobre ella un suspiro para que no esté tan sola. Elias Regules - Mi Tapera https://t.co/6UKwbvMTKz","1126065132633767936","https://pbs.twimg.com/media/D6CWQo1WsAETaBD.jpg","","es","Durazno, Uruguay","1","3","24","https://x.com/elbaqueano27/status/1126065132633767936","2649196628","elbaqueano27"
"1126983439842983936","Fri May 10 22:52:45 +0000 2019","0","Viemos na tapera e não tem muito buraco na rua que milagre","1126983439842983936","","","pt","A procura dela","0","1","0","https://x.com/PpauloVvictor/status/1126983439842983936","1054310598425694208","PpauloVvictor"
"1126966156185743366","Fri May 10 21:44:04 +0000 2019","5","Cevo meu mate solito Num peito quase tapera Só de parceiro o silêncio E o cheiro de simplicidade. Recuerdos de amor distante Num mate feito de espera.","1126966156185743366","","","pt","Palmeira das Missões - RS","0","0","2","https://x.com/WanderlanFarias/status/1126966156185743366","515523734","WanderlanFarias"
"1126557183989121024","Thu May 09 18:38:57 +0000 2019","0","Casa de Tapera https://t.co/1vmlgbKW3a https://t.co/0lvawGYQ8T","1126557183989121024","https://pbs.twimg.com/media/D6JVyfcXkAEq7pZ.jpg","","es","WorldWide","0","0","0","https://x.com/hotpornsites/status/1126557183989121024","309287778","hotpornsites"
"1128055863736963078","Mon May 13 21:54:10 +0000 2019","4","Jai promis a mes negros qu'ils feront du chiffre et on tapera très fort","1128055863736963078","","","fr","","0","1","0","https://x.com/thiierno_sow/status/1128055863736963078","913813492108587009","thiierno_sow"
"1125889137389731840","Tue May 07 22:24:23 +0000 2019","2","Saudades festa da Tapera pqppppppp","1125889137389731840","","","pt","Khlong Se, Thailand","0","0","0","https://x.com/zizian04/status/1125889137389731840","1034557039878582273","zizian04"
"1127441707484598272","Sun May 12 05:13:44 +0000 2019","3","Na moral da época que tapera era conhecida ","1127441707484598272","","","pt","","0","0","0","https://x.com/guizanch1n/status/1127441707484598272","112008028","guizanch1n"
"1125870156767485952","Tue May 07 21:08:57 +0000 2019","1","Les vibration de shownu pendant que nous tapera du pied","1125870156767485952","","","fr","21.07.23💚06.07.19💗04.05.22🧡","0","1","0","https://x.com/namoon_chan/status/1125870156767485952","833447143","namoon_chan"
"1128359260906242049","Tue May 14 17:59:46 +0000 2019","0","️ #AGENDA. #VCAÑAS #VENADO ● Reunión Comité de Cuenca La Picasa (VC) ●Club Ciudad Nueva. ●Agrupación Gaucha La Tapera. ●Club Central Argentuno. ●Club Ciudad (VEN). https://t.co/maoI6brGgS","1128359260906242049","https://pbs.twimg.com/media/D6i8wEJW0AAPBs4.jpg","","es","Venado Tuerto - Argentina","0","0","0","https://x.com/lisandroenrico/status/1128359260906242049","138395690","lisandroenrico"
"1126900287418130434","Fri May 10 17:22:19 +0000 2019","46","Ótimo debate com @traumann ontem na livraria Tapera Taperá sobre o novo livro dele os erros e acertos dos ministros da Fazenda e o estado atual da política econômica. https://t.co/sMGmguAiXv","1126900287418130434","https://pbs.twimg.com/media/D6ON02eXoAUdOK2.jpg","","pt","Brasília","1","3","3","https://x.com/joaovillaverde/status/1126900287418130434","46576649","joaovillaverde"
"1127209999405649920","Sat May 11 13:53:01 +0000 2019","14","We are in Hwedza today #yourbank #financialinclusion #bankaccountforeveryone @stewardbank #kalifekepurple https://t.co/IHcDHS9sWv","1127209999405649920","https://pbs.twimg.com/media/D6SngpjW0AEYqr-.jpg","","en","","1","0","6","https://x.com/TaperaTp/status/1127209999405649920","3434276847","TaperaTp"
"1125408241972928512","Mon May 06 14:33:28 +0000 2019","7","MANTENIMIENTO CALLES DE GRANZA EN: Barrio Alto Camet: Galeana e/ Godoy Cruz y el puente sobre arroyo La Tapera Barrio Libertad/ Ameghino: Av. Errea e/ Av. Luro y Strobel. Barrio Zacagnini: Zeballos y Ferre e/ Tejedor y Roldan entre Ingenieros y Zeballos. @PabloGSimoni https://t.co/NBl5NDyCQJ","1125408241972928512","https://pbs.twimg.com/media/D55AuVvWsAAuIN2.jpg","","es","Ruta 88- km 7 1/2","0","3","6","https://x.com/EmvialMGP/status/1125408241972928512","2282399636","EmvialMGP"
"1125860734267740162","Tue May 07 20:31:31 +0000 2019","2","São José da Tapera: Município do sertão de Alagoas com pouco mais de 32 mil habitantes. O prefeito com um salário bruto de 18 mil e lá tem uma lei que concede pensão vitalícia a viúvas de ex-prefeitos. O pagador de impostos é otário demais. https://t.co/hoEQbgQ4nw","1125860734267740162","https://pbs.twimg.com/media/D5_cXkeWAAAv9OY.jpg","","pt","Maceió 🔁 Rio Largo ","0","0","1","https://x.com/vanildoneto/status/1125860734267740162","99705798","vanildoneto"
"1127434154038235137","Sun May 12 04:43:43 +0000 2019","5","To em Tapera QQ será que os jovens daqui estão fazendo?","1127434154038235137","","","pt","Passo Fundo, Brasil","0","0","0","https://x.com/julianocorazza/status/1127434154038235137","86365132","julianocorazza"
"1127876530552627200","Mon May 13 10:01:34 +0000 2019","1","Thomas Mapfumo once said I have failed to raise my airfare ticket back to AAmerica my gigs are not paying well it's a clear indication that the rich will be richer &amp; the poor will be poorer .","1127876530552627200","","","en","London United  Kingdom ","0","0","0","https://x.com/ChabataTapera/status/1127876530552627200","996436267511500800","ChabataTapera"
"1125398998947389440","Mon May 06 13:56:44 +0000 2019","10","Save the date. Nesta quinta conversa sobre meu último livro e o próximo do @joaovillaverde na Livraria Tapera Taperá (Av. São Luís 187/2) e presença vip do @sergioleo https://t.co/G6ucS7AAxY","1125398998947389440","https://pbs.twimg.com/media/D544atIXsAAeSUr.jpg","","pt","Rio de Janeiro","1","0","2","https://x.com/traumann/status/1125398998947389440","48070448","traumann"
"1121033895326175232","Wed Apr 24 12:51:23 +0000 2019","31","ASSEMBLEIA Formalização da Rede Brasileira da Renda Básica e os desafios da garantia de renda no Brasil Local: Câmara dos Vereadores e DEBATE Renda Básica de Cidadania: política social do século XXI? Lições para o Brasil Local: Livraria Tapera Taperá Galeria Metrópole https://t.co/efYQ7B6xP3","1121033895326175232","https://pbs.twimg.com/media/D4618GkW4AAssAS.jpg","","pt","São Paulo, Brasil","1","1","7","https://x.com/esuplicy/status/1121033895326175232","69373037","esuplicy"
"1120137415543468032","Mon Apr 22 01:29:05 +0000 2019","7","4/5 no Tapera Taperá https://t.co/HkGMZPqt4t","1120137415543468032","https://pbs.twimg.com/media/D4uHCbOXoAAYfpc.jpg","","pt","São Paulo, Brasil","0","3","2","https://x.com/acacio1871/status/1120137415543468032","2284943765","acacio1871"
"1124297381544173569","Fri May 03 12:59:18 +0000 2019","15","Faites un hechter et on tapera les eux millions","1124297381544173569","","","fr","walking on the moon","0","1","0","https://x.com/chucknorrisPSG/status/1124297381544173569","1025210371","chucknorrisPSG"
"1120956551467085824","Wed Apr 24 07:44:02 +0000 2019","11","GM Africa UPI Mr Luping Zhang &amp; Steward Bank Finance Director Mr Alfred Chaavure giving remarks https://t.co/mWt9rIpBdQ","1120956551467085824","https://pbs.twimg.com/media/D45wCH1WsAAZ_tx.jpg","","en","","0","1","3","https://x.com/TaperaTp/status/1120956551467085824","3434276847","TaperaTp"
"1122179395530166272","Sat Apr 27 16:43:11 +0000 2019","4","minha vida em 5 bus FORQUILHAS tirio-ticen via costeira corredor sudoeste via costeira tapera/saco dos limões ufsc semidireto quando to atrasada","1122179395530166272","","","pt","","2","1","0","https://x.com/cachorralilica/status/1122179395530166272","2868333484","cachorralilica"
"1121358661673193478","Thu Apr 25 10:21:53 +0000 2019","1","O sol veio dar bom diaaaaa muito bom dia a todos!!! Ja to me encaminhando pra ir pra escola na tapera trabalhar só agradece pela minha saúde e por esse nascer do sol lindo dar as caras","1121358661673193478","","","pt","Florianópolis, Santa Catarina","0","0","0","https://x.com/retisabroering/status/1121358661673193478","721500146782072832","retisabroering"
